{
 "authority": {
  "can_decide": false,
  "note": "Commander counterfactual simulator deltas are bounded test evidence only; they cannot decide commander value or deck changes."
 },
 "canonical_hash": "lh1:5c53783a710fc838b14a3ae828ec909e3f911cea14d9fdf4bb23bc4b9da1a999",
 "confidence": "low",
 "deck_id": "The_Madcap_Jester",
 "evidence_class": "test_result",
 "limitations": [
  "Goldfish/proxy results are not multiplayer win rates or estimates of real-game win probability.",
  "The unavailable mode removes commander access without adding a replacement library card; this isolates command-zone availability rather than changing deck size.",
  "The taxed mode is a sensitivity point (+2 starting generic commander cost), not a distribution of commander tax in real games.",
  "The disrupted mode reuses the legacy deterministic commander-removal stress hook; multi-commander decks receive a bounded one-at-a-time proxy, not simultaneous pair disruption.",
  "First key-set access means access to any member, not package completion or engine-online probability.",
  "v1.1 omits many commander-native mechanics; structural Blueprint evidence must be read alongside dynamic deltas.",
  "No scalar commander-dependence score is produced."
 ],
 "metrics": {
  "disrupted": {
   "combo_assembled_by_turn6": 0.164,
   "commander_cast_by_turn6": 0.952,
   "commander_turn_mean_when_cast": 3.78989898989899,
   "disruption_recovery": {
    "recast_after_removal_share": 0.9212121212121213,
    "recovery_turns_mean": 1.888157894736842,
    "removal_event_share": 0.99,
    "scenario": "commander_removed_twice from turn 4; for multi-commander decks the legacy stress hook removes one on-board commander at a time and is therefore only a bounded disruption proxy"
   },
   "extra_cards_drawn_mean": 0.0,
   "fast_mana_uses_mean": 0.46,
   "first_key_set_access_by_turn4": {
    "pkg:compact-wins": 0.67,
    "pkg:exile-payoffs": 0.744,
    "pkg:free-protection": 0.572,
    "pkg:library-exile": 0.696
   },
   "mana_available_t1_6_mean": 23.836,
   "mana_spent_t1_6_mean": 19.946,
   "note": "first_key_set_access means first access to any member of the simulator key set; it is not package completion or engine-online probability.",
   "samples": 500,
   "tutors_resolved_mean": 0.898,
   "win_proxy_by_turn6": 0.158
  },
  "normal": {
   "combo_assembled_by_turn6": 0.2,
   "commander_cast_by_turn6": 0.952,
   "commander_turn_mean_when_cast": 3.78989898989899,
   "extra_cards_drawn_mean": 0.0,
   "fast_mana_uses_mean": 0.314,
   "first_key_set_access_by_turn4": {
    "pkg:compact-wins": 0.67,
    "pkg:exile-payoffs": 0.744,
    "pkg:free-protection": 0.572,
    "pkg:library-exile": 0.696
   },
   "mana_available_t1_6_mean": 23.906,
   "mana_spent_t1_6_mean": 17.07,
   "note": "first_key_set_access means first access to any member of the simulator key set; it is not package completion or engine-online probability.",
   "samples": 500,
   "tutors_resolved_mean": 0.904,
   "win_proxy_by_turn6": 0.194
  },
  "taxed": {
   "combo_assembled_by_turn6": 0.192,
   "commander_cast_by_turn6": 0.682,
   "commander_turn_mean_when_cast": 5.567982456140351,
   "extra_cards_drawn_mean": 0.0,
   "fast_mana_uses_mean": 0.384,
   "first_key_set_access_by_turn4": {
    "pkg:compact-wins": 0.68,
    "pkg:exile-payoffs": 0.744,
    "pkg:free-protection": 0.572,
    "pkg:library-exile": 0.696
   },
   "mana_available_t1_6_mean": 23.812,
   "mana_spent_t1_6_mean": 17.424,
   "note": "first_key_set_access means first access to any member of the simulator key set; it is not package completion or engine-online probability.",
   "samples": 500,
   "tutors_resolved_mean": 0.904,
   "win_proxy_by_turn6": 0.186
  },
  "unavailable": {
   "combo_assembled_by_turn6": 0.198,
   "commander_cast_by_turn6": 0.0,
   "commander_turn_mean_when_cast": null,
   "extra_cards_drawn_mean": 0.0,
   "fast_mana_uses_mean": 0.304,
   "first_key_set_access_by_turn4": {
    "pkg:compact-wins": 0.69,
    "pkg:exile-payoffs": 0.744,
    "pkg:free-protection": 0.572,
    "pkg:library-exile": 0.694
   },
   "mana_available_t1_6_mean": 24.09,
   "mana_spent_t1_6_mean": 14.306,
   "note": "first_key_set_access means first access to any member of the simulator key set; it is not package completion or engine-online probability.",
   "samples": 500,
   "tutors_resolved_mean": 0.908,
   "win_proxy_by_turn6": 0.192
  }
 },
 "model": {
  "modes": {
   "disrupted": "existing commander_removed_twice stress proxy from turn 4",
   "normal": "canonical commander(s) available",
   "taxed": "+2 generic on every commander's first cast, then normal tax increments",
   "unavailable": "commander(s) absent for entire game; 99-card library unchanged"
  },
  "paired_library_permutations": true,
  "samples": 500,
  "seed": 69,
  "simulator": "grixis_sim v1.1",
  "turns": 10
 },
 "normal_minus_counterfactual": {
  "disrupted": {
   "combo_assembled_by_turn6": 0.036,
   "commander_cast_by_turn6": 0.0,
   "extra_cards_drawn_mean": 0.0,
   "fast_mana_uses_mean": -0.146,
   "first_key_set_access_by_turn4": {
    "pkg:compact-wins": 0.0,
    "pkg:exile-payoffs": 0.0,
    "pkg:free-protection": 0.0,
    "pkg:library-exile": 0.0
   },
   "mana_available_t1_6_mean": 0.07,
   "mana_spent_t1_6_mean": -2.876,
   "tutors_resolved_mean": 0.006,
   "win_proxy_by_turn6": 0.036
  },
  "taxed": {
   "combo_assembled_by_turn6": 0.008,
   "commander_cast_by_turn6": 0.27,
   "extra_cards_drawn_mean": 0.0,
   "fast_mana_uses_mean": -0.07,
   "first_key_set_access_by_turn4": {
    "pkg:compact-wins": -0.01,
    "pkg:exile-payoffs": 0.0,
    "pkg:free-protection": 0.0,
    "pkg:library-exile": 0.0
   },
   "mana_available_t1_6_mean": 0.094,
   "mana_spent_t1_6_mean": -0.354,
   "tutors_resolved_mean": 0.0,
   "win_proxy_by_turn6": 0.008
  },
  "unavailable": {
   "combo_assembled_by_turn6": 0.002,
   "commander_cast_by_turn6": 0.952,
   "extra_cards_drawn_mean": 0.0,
   "fast_mana_uses_mean": 0.01,
   "first_key_set_access_by_turn4": {
    "pkg:compact-wins": -0.02,
    "pkg:exile-payoffs": 0.0,
    "pkg:free-protection": 0.0,
    "pkg:library-exile": 0.002
   },
   "mana_available_t1_6_mean": -0.184,
   "mana_spent_t1_6_mean": 2.764,
   "tutors_resolved_mean": -0.004,
   "win_proxy_by_turn6": 0.002
  }
 },
 "schema_version": 1,
 "slug": "the-madcap-jester",
 "status": "provisional_test_evidence",
 "structural_context": {
  "accepted_blueprint_role": {
   "advances_plan": "The Jester turns every library exile into card access, and its attack trigger is a built-in exile burst.",
   "confidence": "high",
   "evidence_class": "strategic_judgment",
   "honest_note": "Honest call: significant. None of the four Spellbook combos uses the Jester; the kills are generic Grixis cEDH lines (Oracle/Consult, Oracle/Tainted Pact, Breach + LED/Petal + Brain Freeze). The source added Consultation and Tainted Pact explicitly to complete them (decisions L27, L28). The Jester is a future-release card (project exception, legal from 2026-11-13 per decisions L57) and is not officially Commander-legal today.",
   "level": "significant"
  },
  "path": "data/grixis/commander_structure/the-madcap-jester.json",
  "summary": {
   "blueprint_wins": 3,
   "blueprint_wins_explicit_commander": 1,
   "blueprint_wins_structurally_independent": 2,
   "combo_blueprint_supported": 0,
   "combo_commander_independent": 4,
   "combo_direct_commander_piece": 0,
   "engines": 2,
   "engines_explicit_commander": 2,
   "required_packages": 4,
   "required_packages_explicit_commander": 0,
   "spellbook_lines": 4
  }
 },
 "unmodeled_required_dimensions": [
  "true meaningful-action count (v1.1 does not expose cast/action events)",
  "commander-native triggered/activated value not represented by v1.1 mechanics",
  "opponent interaction and multiplayer politics",
  "exact partner-pair disruption of both commanders simultaneously"
 ]
}
